{
  "eventId": "10000000-0000-4000-8000-000000000101",
  "schemaVersion": 1,
  "eventType": "loyalty.reward.redeemed",
  "tenantId": "courseflow",
  "applicationId": "learn",
  "programId": "default",
  "rewardId": "40000000-0000-4000-8000-000000000001",
  "redemptionId": "50000000-0000-4000-8000-000000000001",
  "accountId": "20000000-0000-4000-8000-000000000001",
  "burnEntryId": "30000000-0000-4000-8000-000000000101",
  "reversalEntryId": null,
  "profileId": "learner-123",
  "rewardCode": "CERT-FEE-WAIVER",
  "pointsCost": 500,
  "status": "COMMITTED",
  "fulfillmentStatus": "PENDING",
  "fulfillmentRef": null,
  "sourceReference": "reward:40000000-0000-4000-8000-000000000001:checkout-123",
  "correlationId": "checkout-123",
  "actorId": "learner-123",
  "note": "Learner redemption",
  "redeemedAt": "2026-06-14T08:10:00Z",
  "fulfilledAt": null,
  "reversedAt": null,
  "metadata": {
    "idempotencyReplay": false
  }
}
